<?xml version="1.0" encoding="UTF-8"?>
<!--W3C Schema generated by XMLSpy v2011 rel. 2 (http://www.altova.com)-->
<xs:schema xmlns:xs="http://www.w3.org/2001/XMLSchema">
	<xs:element name="ville" type="xs:string"/>
	<xs:element name="rs">
		<xs:simpleType>
			<xs:restriction base="xs:string">
			 
			</xs:restriction>
		</xs:simpleType>
	</xs:element>
	<xs:element name="destinataire" type="xs:string"/>
	<xs:element name="cp" type="xs:string"/>
	<xs:element name="clients">
		<xs:complexType>
			<xs:sequence>
				<xs:element ref="client" maxOccurs="unbounded"/>
			</xs:sequence>
		</xs:complexType>
	</xs:element>
	<xs:element name="client">
		<xs:complexType>
			<xs:sequence>
				<xs:element ref="rs" minOccurs="0"/>
				<xs:element ref="destinataire"/>
				<xs:element ref="adr1"/>
				<xs:element ref="adr2"/>
				<xs:element ref="cp"/>
				<xs:element ref="ville"/>
			</xs:sequence>
			<xs:attribute name="type" type="xs:string" use="required"/>
			<xs:attribute name="id" type="xs:short" use="required"/>
		</xs:complexType>
	</xs:element>
	<xs:element name="adr2">
		<xs:complexType/>
	</xs:element>
	<xs:element name="adr1" type="xs:string"/>
</xs:schema>
